第A13版：,彩票,2016-02/17,大年初八，大乐透送出祝福,□记者张琛星本报讯春节拜年送祝福，“漫长”的休市期后，大年初八，体彩大乐透再出千万大奖。2月15日晚，大乐透第16017期开出1注头奖，单注奖金1000万元，花落贵州。本期开奖后，大乐透奖池滚存至24.35亿元。猴年“猴赛雷”，万事好彩头。据了解，此次获得大乐透头奖的幸运彩民来自贵州黔南州，中奖彩票是一张“大面额”的复式票。其前区选择12个号码，后区选择2个号码，组成“12+2”大复式，形成792注投注号码，投注金额1584元，除命中1注一等奖外，还中得三等奖35注，四等奖210注，五等奖350注，六等奖196注，单票总奖金1016万元。本期全国共中出二等奖32注、三等奖733注，单注基本奖金分别为20.3万元、3444元。从此次开奖情况来看，作为春节休市后的第一期，大乐透头奖开出，也是在春节期间送出了祝福，送出好彩头。此外，大乐透奖池也不断刷新纪录。休市前，大乐透第16016期开奖后，奖池首次突破24亿元大关，滚至24.12亿元。休市后，奖池继续上涨，第16017期开奖后，奖池滚至24.35亿元，持续保持在24亿元以上的高水位。一般来说，高水位奖池增加了冲击巨奖的机会，适当追加、倍投可获取丰厚回报，但也提醒彩民要理性购彩。
第A13版：,彩票,2016-02/17,1098万元双色球再现弃奖,□记者张琛星在备受关注中，直至2月15日晚11点59分，新疆福彩中心的工作人员依然坚守在岗位上，但奇迹终究没有发生，双色球1098万大奖得主仍然没有现身，终成弃奖。据了解，2015年12月15日，2注双色球头奖花落新疆，庆贺之余，大奖得主却迟迟没有现身。按照相关规定，中奖者应当自开奖之日起60个自然日内兑奖，随着兑奖截止日期临近，新疆福彩中心多次通过网络、报纸等平台寻找大奖得主。当期兑奖截止日期的最后一天，2月15日，新疆福彩中心安排相关工作人员留守等待大奖得主，直到兑奖时限的最后一刻，大奖得主仍未出现在福彩中心，这意味着1098万元大奖成为弃奖，这是新疆福利彩票上市以来的最大弃奖。“这位中奖彩民实在太大意，太可惜了！”销售该大奖彩票的投注站业主遗憾地说。弃奖让人遗憾，却并不鲜见。1月11日，东莞双色球2565万巨奖没人领取，成为迄今为止我国彩票史上最大的弃奖。根据我国《彩票管理条例》规定，逾期未兑奖的奖金，纳入彩票公益金，因此，1098万元弃奖奖金将纳入彩票公益金，直接用于社会公益事业。
第A11版：,综合,2016-02/17,图斯克称欧盟正面临“危急”时刻,新华社布加勒斯特2月15日电欧洲理事会主席图斯克15日晚在罗马尼亚首都布加勒斯特表示，欧盟正面临一个“危急”时刻，即将举行的欧盟春季峰会将讨论英国的欧盟成员国地位问题和移民危机问题。他希望各成员国竭尽全力应对所有挑战。图斯克当天在与罗马尼亚总统约翰尼斯会晤后举行的联合新闻发布会上说，英国是否留在欧盟只能由英国人民自行决定，但这也关系到欧盟的未来。图斯克说，他提出了欧盟与英国签署一个新协议的建议，但他也承认，目前还有一些政治问题尚未解决。去年11月，英国首相卡梅伦就英国留在欧盟的条件发表演讲，提出欧盟改革的4个目标。卡梅伦表示，如果欧盟对英国的诉求充耳不闻，将不排除英国通过公投脱离欧盟的可能性。
第A13版：,彩票,2016-02/17,春节收红包周口彩民喜领双色球头奖,第A14版：,证券,2016-02/17,豫股全线上涨,周二豫股指数早盘小幅高开，全天维持单边上扬走势，收盘于8596.88点，大涨3.85%，成交金额127.21亿元，较上日成交明显放量。73家豫股上市公司中，5家停牌，其余68家全线上涨。其中黄河旋风、森源电气等7只个股涨停，洛阳钼业、宇通客车等个股涨幅居后。从盘面上看，豫股指数经过连续两日上涨后，已经突破2月4日高点形成的阻力位，且5日、10日均线形成金叉，初步判断豫股指数开始从横盘振荡走势步入振荡上涨走势。大盘方面，周二早盘，两市高开高走，沪指很快涨幅扩大至2%，并重新站上2800点，题材股与权重股齐飙升，两市成交量明显放大，增量幅度超50%。28家申万一级行业全线上涨，其中计算机、国防军工等涨幅居前，银行、有色涨幅相对居后。春节之后的A股表现强势，先是让市场暂时摆脱了外围环境的恶劣，经过周二三大指数的一致性放量上涨，短期下跌趋势扭转，市场迎来可操作性机会。在豫股投资机会上，建议适度增仓参与反弹，但切勿追涨，也不宜仓位过大。投资标的可以选择前期跌幅较大，近两日明显放量的小盘股操作。中原证券
第A14版：,证券,2016-02/17,国旅联合全面转型升级,国旅联合（600358）：公司业绩符合预期，通过处置资产等实现扭亏为盈，同时积极布局户外文体娱乐。给予增持评级。战略发展上，公司将向户外文体产业转型升级，通过投资收购优质项目和产业基金运作实现快速切入。1.体育产业中，取得冬奥会市场开发权以及试水泰拳项目，公司已熟悉如何优先把控上游优质体育赛事资源，收购盈博讯彩和哈林秀王则向体育媒体社区、人才培训等领域延伸，完善生态链。2.文旅产业上，公司与山水盛典合作开发《昭君出塞》等进展顺利，2016年有望实现演出常态化，形成公司业绩新贡献。3.合作设立三大产业并购基金，总规模合计达到45亿元，将为公司体育和文化娱乐旅游项目的开拓提供有效支持。风险提示:酒店经营业绩下滑;转型文旅和体育效果不及预期。国泰君安
第A14版：,证券,2016-02/17,交运业：航空独领风骚物流多点开花,第A16版：,综合,2016-02/17,培养兴趣比培养精英更重要,□记者王小娟这个寒假，河南的青少年或许会感觉有那么点不一样――击剑冬令营、足球冬令营、射击冬令营、马术冬令营……春节前后，各类体育主题的冬令营纷纷开班，相比往年的一些“草台班子”，今年冬令营呈现一个共同的特点，就是由省队的专业团队执教，代表了这项运动在河南的顶尖水平。这些冬令营少则10余人，多则70余人，受训队员有的是从全省各地挑选的苗子，有的则是直接面向全社会征集，在走访冬令营的时候，听到孩子们说得最多的一句话就是“太好玩了，今年夏令营还要来”。一位年轻的母亲幽默地告诉记者，“投资什么都有风险，只有投资孩子的体育爱好稳赚不赔，不管将来能不能成为职业，至少赚了个好身板和好心态。”去年的《中国青少年体质健康行为调查》显示，因城市化的发展，我国60%以上的学生居住环境不具备进行体育运动的条件；在休息和节假日的空闲时间，学生们出去运动的不足30%。而我们的近邻日本，中学里加入各类体育联盟的学生占到所有初中生的近70%。教育部体卫艺司司长、中国足协副主席王登峰曾说：“很多家长认为，孩子在考上好大学之前，可以先不要体育锻炼，等上了大学之后再去‘补’。可现实却是，很多孩子上了大学之后，也不可能去‘补’体育锻炼。”正如退役后一直致力于青少年训练营的姚明所言，“我们不要急于培养下一个可以进入NBA或者CBA的球员，我们希望更多的孩子可以在课余时间进行一项体育运动，学习怎样和同龄人打交道，怎样和同龄人合作。在青少年培训方面我们要设定一个正确的目标――不要那么急地把他们往精英方向推进，更重要的是把他们的兴趣培养出来。”
第A16版：,综合,2016-02/17,省万村千乡农民篮球总决赛开战,□记者王玮皓本报讯为推动全省全民健身事业的持续、健康、快速发展，丰富我省人民群众春节期间的体育文化生活，昨日，中国体育彩票・河南省第八届万村千乡农民篮球总决赛暨河南省第十四届春节农民篮球赛北部赛区比赛在中牟县拉开战幕。据悉，本次比赛由河南省体育局、河南省文明办、河南省农业厅主办，河南省球类运动管理中心、郑州市体育局、河南省篮球协会承办，中牟县教育体育局协办。共有来自省内的郑州、新乡、三门峡等14支队伍160多名运动员参加。自2月16日开始至2月20日结束，设两个赛场。比赛将决出一等奖3个、二等奖4个、三等奖5个、优秀奖2个。比赛结束后南北赛区前四名的队伍将参加河南省第五届万村千乡农民篮球赛南北争霸赛。一年一度的河南省万村千乡农民篮球赛，是河南省群众体育活动的重要组成部分，现已发展成为河南省群众体育品牌赛事，有力地推动了农村体育健康发展。
第A16版：,综合,2016-02/17,斯诺克需要奥沙利文的任性,□邢涛在完全能够打出满分的情况下，奥沙利文故意少得一分。人比人气死人，斯诺克圈子高手如云，但不是每个人都能轻易拿到满分，敢向这一万英镑奖金说不的更是寥寥。当然，奥沙利文的行为随之引来了国际台联主席的不满，称他没有尊重观众。奥沙利文就像一个高傲的学生，因为给的奖品太少赌气，能考100分时偏偏少做一题得99分。国际台联主席赫恩就像考生的父亲，嘴上不满儿子的任性，心里却为儿子得意。当然，这个比喻并不太恰当，但可以说明奥沙利文对国际台联主席以及斯诺克运动的重要性。有了这“不完美”的一击，人们这才知道斯诺克满分奖竟然少得“可怜”。因为奥沙利文，人们又将目光聚焦在斯诺克上。奥沙利文已是40岁的“高龄”，在复出并不算长的时间已经创造了许多个纪录。不久前的冠军联赛第一小组的比赛，奥沙利文在两天的比赛中轰出七杆破百，生涯破百总数超过800杆，成为史上第一人。随后谈笑间拿下个人的第六座大师赛奖杯。斯诺克是项正在萎缩的运动，其顶级赛事世锦赛的最高奖金还不及网球大满贯赛冠军奖金的零头。在这里不去分析斯诺克衰退的原因，但应该知道斯诺克太需要奥沙利文来站台面了。奥沙利文球技精湛，为观众奉上精彩的比赛；他玩世不恭，为读者奉上饭后谈资。有这样的标志性人物，国际台联主席偷着乐吧。
第A16版：,综合,2016-02/17,梅西的点球和奥沙利文的146,第B06版：,养生,2016-02/17,不起眼的小食品暗藏养生奇效,□康佳现代社会人们都追求健康，希望通过各种方式达到养生功效，有些人甚至一掷千金购买各种昂贵的保健品。其实，饮食养生就在身边的细微处，比如一些不起眼的小食品竟然暗藏着神奇的养生功效哦！1.花生功效：预防皮肤病花生中富含的维生素B2，正是我国居民平日膳食中较为缺乏的维生素之一。有意多吃些花生，不仅能补充日常膳食中维生素B2之不足，而且有助于防治唇裂、眼睛发红发痒、脂溢性皮炎等多种疾病。2.核桃功效：润泽皮肤核桃中86%的脂肪是不饱和脂肪酸，核桃富含铜、镁、钾、维生素B6、叶酸和维生素B1，也含有纤维、磷、烟酸、铁、维生素B2和泛酸。核桃仁富含的油脂，有利于润泽肌肤，保持人体活力。3.黑巧克力功效：抗抑郁黑巧克力是指可可固形物含量介于70%~99%，或乳质含量少于12%的巧克力。有研究表明，吃黑巧克力，会给人以愉悦的心情，从而在更大的意义上降低了更多疾病的发生。4.葵花子功效：壮阳葵花子的蛋白质含量为30%，可与大豆、瘦肉、鸡蛋、牛奶相比；各类糖的含量为12%；脂肪含量优于动物脂肪和植物类油脂，葵花子的蛋白质中含有精氨酸。精氨酸是制造精液不可缺少的成分。处在生育期的男人，每天食用葵花子对身体是非常有好处的。
第B06版：,养生,2016-02/17,“雨水”到来，让身体随自然苏醒吧,□记者林辉核心提示|本周五将迎来二十四节气中的第二个节气“雨水”。雨水为万物生长之源，这个节气也意味着春天正向我们走来。那么，在“雨水”之时应在保健养生方面注重哪些呢？“雨水是最容易出现倒春寒的节气，因此，冬天的衣服先别急着脱掉，谨防受凉后诱发呼吸道疾病。”河南中医学院第一附属医院治未病健康管理中心主任李力说，虽然接下来几天，郑州白天的最高温度会超过14℃，但大家还是要穿冬衣的，因为人体也同自然界一样，在春天开始复苏，原先处于“冬眠”的皮肤细胞开始活跃起来，毛孔张开。这时，当冷风袭来时，就能长驱直入，使人感到寒冷。所以，莫要天气稍微转暖就急于脱棉服秋裤，这就是“春捂”。李力提醒，“春捂”也不能过分，以防捂过头使人上火、血压升高，原则是注意下厚上薄，捂的重点在背、腹、足底。“雨水”时节提倡“晚睡早起”。河南中医学院第三附属医院康复科主任胡斌解释说，这是因为雨水以后，天气转暖，阳气回升，万物生发。随着时间推移，白昼时间越来越长，晚上时间随之变短，大家的作息也应随着这种变化而做出相应的调整，所以“晚睡早起”就变得很有必要。当然，“晚睡早起”也是有限度的，晚睡不宜过晚，早起也不能过早。胡斌说，雨水时节睡眠的最好时间是晚上11点到早上6点。同时，若中午能小睡片刻，可给身体一个适应昼长夜短的时间。宜“春捂”，晚睡早起健脾胃，养肝护肝“雨水”时节，由于雨水增多，湿气随之而来，对人体会造成湿困脾胃的危害，产生食欲不振、消化不良、腹泻等症状。而中医认为，脾胃为“后天之本”“气血生化之源”，可见，脾胃健旺是人们健康长寿的基础。胡斌说，雨水前后饮食以平性为宜。应少吃酸味，适当吃甜味，以养脾脏。可选择韭菜、香椿、百合、豌豆苗、茼蒿、荠菜、春笋、山药、藕、芋头、萝卜、荸荠、甘蔗等。雨水前后，在调养脾胃的同时，还应注意养肝。李力解释说，雨水属于春季的节气，春季与肝均属木性，肝的功能正常时，好像春天树木那样条达舒畅，充满生机，因而春季养肝，利于防病保健。李力说，雨水前后人体肝脏功能较为旺盛，故应注意减酸增甘，多进食时鲜果蔬，利于阳气生发。另外，还应注重精神调理，保持情绪乐观舒畅，以使肝气顺达，气血调畅。线索提供张永艳孙璐
第A01版：,头版,2016-02/17,新闻推荐,第A01版：,头版,2016-02/17,郏县好儿媳带着百岁婆婆去打工,【A07版】
第B02版：,策划,2016-02/17,地产班干部“围炉夜话”,第A01版：,头版,2016-02/17,大年初六“勤贼”撬走古桥石刻,【A08版】
第C05版：,生活实验,2016-02/17,自磨豆浆，沸腾后至少再煮 10分钟,第C02版：,热点,2016-02/17,近期主干道又“忙”起来,□记者高鸿鹏通讯员孟繁勇本报讯近日，随着返郑车辆的增多，郑州金水路、花园路等主干道的高峰期车流量已率先恢复至节前的繁忙状态，2月16日，郑州交警部门发布出行提醒，高峰期驾驶员应尽量避免集中驶入主干道，可选择车辆较少的次干道或支路通行。昨天早上7时30分，大河报记者驱车沿纬五路、政六街、黄河路、花园路、金水路等道路通行，明显感觉到金水路、花园路等主干道的车流量比较大，而与主干道平行的一些支路及小路车流量较小。“从2月15日晚高峰开始，金水路车流量已经恢复至节前水平，尤其是东向西方向的车辆更多，已出现行车速度缓慢及排队现象。”郑州交巡警一大队六中队指导员韦佑永分析有四个方面的因素：一是随着春节假期结束，返郑的车辆明显增加；二是金水路呈现西向东出城方向车道逐渐增多，行车速度逐渐加快，而东向西入城方向车道逐渐缩减，行车速度缓慢的现象；三是由于近期陇海快速路音屏障施工造成道路拥堵，很多车辆放弃陇海快速路而改走金水路，另外这两天天气晴好，刺眼的阳光也对行车造成一定的影响。韦佑永建议，由于中小学还处在放假期间，一些和主干道平行的支路和小路相对车少，车主可选择这些道路通行。
第C04版：,民生,2016-02/17,气温如“窜天猴”一下蹿到十几度,□见习记者韩谨伊文记者白周峰摄影本报讯这段时间，郑州的天气如同一只“泼猴”。新年伊始，它给绿城带来了20℃温暖如春的好天；初五时，给绿城带来了罕见的春雨；春节假期结束时，带来了5级大风和狂降8℃-10℃；预计从今天开始郑州又要进入升温期，未来两天最高气温将蹿至16℃。预计今明两天，升温将成为绿城天气的主旋律。今天白天，气温将逐渐回升至较常年同期偏高的态势。据郑州市气象台预测，今天，郑州最高气温将升至13℃；明天天气依旧晴好，气温也将继续上蹿，最高气温将升至15℃，最低气温也将回升至冰点以上，达1℃-2℃。
第C02版：,热点,2016-02/17,陇海快速路被施工拖累成“慢性子”,第C04版：,民生,2016-02/17,2月27、28日近万个岗位等你挑,第C04版：,民生,2016-02/17,今年市区再添 20个街角游园,□记者刘瑞朝本报讯记者昨日从郑州市园林局了解到，未来五年郑州市每年要新增500万平方米绿地，除常规性的市级和区级公园外，今年还将建成20个街角游园，年底前免费开放。在郑州市生态建设和环境治理工作动员大会上，郑州市委市政府确定了“十三五”期间的园林绿化目标。据介绍，未来这5年，郑州市要实现新增森林面积23.7万亩，建设450公里生态廊道，森林覆盖率达到35%以上。园林绿化新建绿地2500万平方米，这也意味着每年要新增500万平方米绿地。而建成区绿地率要达到37%，绿化覆盖率达到42%，人均公园绿地面积达到12.2平方米。此次建设的20个街角游园，类似于经三路农业路西北角、桐柏路中原路西南角等处的规制。20个街角游园于砦游园：工人路于砦安置村北棉纺路游园：棉纺路与桐柏路东北侧合作路游园：合作路陇海铁路交会处东南区域端午路游园：大学路端午路交叉口东南角区域丰庆路游园：丰庆路与国基路交叉口茂华路游园：茂华路（花园路―徐寨路）之间紫东河园：紫东路与紫辰路交叉口东150米紫秀园：城东南路与紫东路交叉口王岗社区游园：迎宾馆与文化路交叉口江山路节点游园：江山路与开元路交叉口平安大道道路游园：明理路至博学路心悦游园：站南路与安平路交会处电子商务游园：商都路与东四环交叉口学子园：红松路、科学大道以北，轻工业学院西门处IT游园：黄栌路与（科学大道―枫香西街）交会处恒大游园：经南三路（第九大街―107辅道路南）滨河新区游园：十五大街以西，经南八路以南新港游园：S102和新港大道交叉口和昌游园：新港十一路与苑林西路东南角航兴游园：航兴路与新港十一路交叉口
第C01版：,绿城新闻,2016-02/17,施工一占再好的车再快的路也是慢,近期陇海快速路因隔音墙施工造成拥堵，市民建议道路施工能否错时？C02版
第C04版：,民生,2016-02/17,本周六，有场大型招聘会,□记者李岚本报讯昨天，记者从巩义市人社局获悉，2月20日将在东区人社局举办“巩义・2016城乡就业春季招聘会”。届时，将推出8000多个工作岗位，供求职者随意挑选。据巩义市人社局工作人员介绍，此次招聘会将有120余家用人单位纳贤求才，提供的各类就业岗位涉及普通操作工、业务销售、电子商务、外贸人员、财务会计、部门主管、商超及餐饮服务等80余个工种。线索提供崔峻萌
第C01版：,绿城新闻,2016-02/17,气温如“窜天猴”从零下蹿至十几度,第C01版：,绿城新闻,2016-02/17,出门看天,今日：晴天转多云，西北风3到4级，-1℃～13℃明日：晴天转阴天，0℃～16℃后日：晴天间多云，西北风4级，0℃～15℃
第C01版：,绿城新闻,2016-02/17,46岁男环卫工正扫地突然摔倒再没醒来,为挣300块钱加班费，他春节只休息了两天大部分收入用于孝敬母亲，娘睡屋他睡楼梯间C06版
第C03版：,市情,2016-02/17,1月空气质量郑州排名倒数第四,□记者刘瑞朝文许俊文摄影核心提示近日全国74个重点城市1月份空气质量排名出炉，郑州从去年11月份的后十名开外，先是跌到倒数第八，上个月又跌到了全国倒数第四，这个位次比去年同期还低一位。据了解，郑州今年的治霾新目标是空气质量排名要从全国倒数第五冲出“后十位”。【排名】1月空气质量，郑州排名仍在“后十”环境保护部环境监测司司长罗毅近日向媒体通报说，1月，按照《环境空气质量标准》（GB3095-2012）评价，全国338个地级及以上城市平均达标天数比例为66.7%，同比上升13.6个百分点。在京津冀、长三角、珠三角区域及直辖市、省会城市和计划单列市等74个城市中，保定、乌鲁木齐、邢台、郑州、石家庄、邯郸、济南等21个城市达标天数比例不足50%。超标天数中以PM2.5为首要污染物的天数最多，其次是PM10。按照城市环境空气质量综合指数评价，1月74个城市中，空气质量相对较差的10个城市（从第74名到第65名）依次是保定、乌鲁木齐、邢台、郑州、石家庄、邯郸、济南、衡水、西安和唐山；空气质量相对较好的10个城市（从第1名到第10名）依次是海口、惠州、拉萨、厦门、深圳、江门、肇庆、东莞、福州和昆明。记者注意到，郑州的排名近期在连续下跌，去年11月份在后十名之外，去年12月份下跌至倒数第八，今年1月份继续下跌至倒数第四。【分析】1月前10天，4个重度污染+5个严重污染+1个轻度污染罗毅说，总体来看，1月全国地级及以上城市空气质量有所改善，平均达标天数比例同比上升，PM2.5等六项指标浓度同比均下降，重度及以上污染天次有所减少。但具体到郑州来说，情况并不太乐观。记者注意到，去年1月份郑州的排名为倒数第五，这也意味着，郑州2016年的起点比2015年要低一位。按照空气质量级别，1月份郑州没有1天是“优”，重度污染以上的天气主要集中在上半月。根据分析，郑州空气污染的首要污染物仍以PM2.5和PM10为主，但在重污染以上的空气质量条件下，首要污染物仍为PM2.5。1月1日到1月10日期间，郑州有4天是重度污染，有5天是严重污染，1天是轻度污染。【相关】环保部通报正月初五、初六空气质量，新乡被点名环保部监测司副巡视员刘舒生说，正月初五至初六（2月12日19时至2月13日6时），我国338个地级及以上城市监测结果显示，279个城市空气质量优良，其余59个城市空气质量超标，其中10个城市达到重度及以上污染。河南新乡市，河北石家庄市、邢台市，吉林白山市和山东莱芜市等5个城市空气质量为重度污染。
