风尚珠宝,2016-02/19,珠宝新品“猴赛雷”,□记者闫碧洁一元复始，万象更新，温婉贤淑的肖羊之年过去，我们迎来了活跃好动、机智聪敏的猴年。为了预祝未来一年事事顺意，各品牌相继推出了生肖系列的珠宝配饰，奢侈品品牌如路易威登、迪奥也以“猴年”为主题，推出中国新年特别款。可是，外国设计师的作品实在无法诠释出中国年的韵味，有些设计让人不禁感叹――“你确定这是只猴儿？”毕竟，生肖年是咱中国人的传统，美猴王的美只有咱们自己懂，那些中国的能工巧匠设计出的猴年珠宝新品才是真正的“猴（好）赛（犀）雷（利）”！金美福萌猴献瑞为爱加冕在新年伊始的吉庆时刻，金美福珠宝特别呈现了充满童心意趣的新春系列，以灵动俏皮的萌趣小猴为主要设计元素，点亮盎然生机，谨献新年新气象的美好祝愿。此款小金猴栩栩如生，线条柔美流畅，设计感十足，由磨砂质感的3D硬金打造，工艺精湛。细节处更是精雕细琢，连小猴的表情也刻画得活灵活现，你有没有被小猴甜甜的微笑打动？象征福禄头戴王冠的小萌猴，在猴年里，为爱加冕，猴（好）运连连！周生生大眼萌猴俏皮耍宝为了更好地诠释猴子灵活多变的神态，周生生运用不同工艺、从各种角度汲取灵感将猴子耍宝爱玩的神韵展现得淋漓尽致，让各式猴子金饰化作活力使者，为新年注入满满能量。“大眼猴”系列中，憨态可掬的猴子与元宝、祥云等元素相融合，寓意招财进宝、平步青云。除此之外，周生生的其它系列更加入凤凰、如意的造型元素，在传达新年之喜的同时，以高贵柔美的线条展现出女性的优雅魅力。英皇珠宝十二生肖有猫为伴英皇珠宝除了以圆润可爱的十二生肖系列催旺运势，更别出心裁，加入深得群众喜爱，却相传因贪睡而错失上肖机会的俏灵猫儿，化身成招财喵喵的可爱姿态，为佩戴者招财进宝，同时与十二生肖共庆团圆。设计师把小猴设计成可爱洋溢的圆滚滚形状，寓意新的一年财源滚滚。猴年出生的人犯本命年太岁，凡事容易出现一波三折，情绪波动较大，宜佩戴鼠及龙形金饰以稳定情绪，平稳运势。属猴的人不妨以本命相合之生肖款式，搭配招财喵喵作为吉祥组合，为猴年催旺，同时增加一份闪亮的动人色彩。六福珠宝金猴献宝大圣归来如果觉得把小猴子戴上身有些过于可爱，不妨考虑在家里或办公室摆放一款金猴摆件。六福珠宝呈献的“金猴献宝”系列有多款形态各异的Q版金猴及英姿飒爽的齐天大圣摆件。每款金猴由纯金铸造，造型栩栩如生、神态惟妙惟肖。金猴坐镇，有加官封“侯”，前程似锦的美好寓意，具有极高的欣赏和收藏价值，且恒久保值。
市场,2016-02/19,中国银行成为首批合作银行,□记者徐曼丽近日记者从中国银行河南省分行获悉，ApplePay服务已确认登陆中国市场，作为首批合作银行，该行自2月18日起全面支持ApplePay服务。带有银联标识的中行借记卡或信用卡持卡人将所持卡片添加到iPhone、AppleWatch或iPad设备上，即可轻松在线下商户及线上App实现便捷安全支付。据中国银行河南省分行相关业务人员介绍，作为国内最早发行信用卡的银行，该行一直以来不断致力于创新和改善客户体验，此次中银长城e闪付旗下再添新产品，支持ApplePay服务，将为客户提供更快捷、更安全的移动支付体验。ApplePay通过应用业界领先的Token（支付标记）、TouchID（指纹验证）及安全芯片技术，保障用户支付安全。在实体商户内，认准银联云闪付标识，可在超市、餐厅、咖啡厅等众多消费场所方便支付。中国银行还将陆续推出ApplePay消费送积分、消费满额返现、消费立减等活动，进一步提升客户体验。
大河风尚,2016-02/19,河南珠宝“口碑榜”正式启动,市场,2016-02/19,为孩子量身打造财商计划,□记者徐曼丽通讯员全权核心提示|近年来，有越来越多的父母意识到应该培养孩子的财商，然而许多父母却不知如何开启财商教育才真正有效。近期，交通银行为高端客户所推出的《小小金融家》财商课，可谓为众多家长打开了这扇门，给孩子量身打造财商的培养计划。而这次《小小金融家》财商课堂是由交通银行携手著名心理学家、情商教育专家张怡筠博士共同打造的培养儿童财商与情商能力的精品课程。交行《小小金融家》，帮孩子打造财富梦本期《小小金融家》的财商课堂，特别请张博士及团队，首次推出了“情商+财商”的创新课程设计，提升孩子的十个情商力，以助力十个重要财商力的培养。《小小金融家》系列课程通过生动活泼的动画视频，丰富有趣的互动游戏，提升孩子对财富的理解和认知，培养孩子内在的情商能力，让孩子在轻松好玩的课程中学习财富管理内涵，掌握人生管理的真谛。让孩子通过《小小金融家》系列活动的学习和体验，成长为真正的金融家。而张博士从事情商教育及研究将近二十年，常听到父母说起的困扰，既包括了孩子情绪管理不佳、亲子关系紧张，也包括了对孩子消费行为的不满。例如父母抱怨:孩子只要求爸妈买买买，而毫不知感恩；或孩子打游戏及花钱失控；或成年孩子成了月光族、卡债奴，甚至染上赌瘾自毁前程。其实，这些行为，都代表孩子的财商出了状况。而财商，其实应该从小教起。张博士特别指出：孩子财商的培养，必须结合情商能力的提升，才能更好地完成。这是因为，孩子需要先有内在心理能力，才能够去达成外在行为目标。例如制定了储蓄计划，要能精准做到，孩子必须先有良好自制力，遇到诱惑不乱花钱，到了时间也固定存钱，才能够一步一步地达成自己的储蓄目标。如果内心缺乏自制力，就会出现“知道，却做不到”的情况。所以，好的财商课，应该从“心”开始。据悉，《小小金融家》项目是交通银行围绕“以客户为中心”的经营理念，针对6-12岁孩子量身设计的财商培养计划。交通银行致力于打造财富管理特色银行，不仅帮助您和您的家庭实现财富的保值增值，也为您及家庭提供更有价值的增值服务，聚集更多的人生财富。情商+财商，孩子才会更“完美”此外，很多父母常困扰于孩子不自信，遇到困难易沮丧；孩子脾气坏，比较爱冲动；自制力差，没耐心……其实这些问题，都是孩子情商能力不足的表现，父母没有重视培养孩子的情商能力！父母要关注的不仅仅是孩子的身体健康，还有孩子的情绪健康！心理学家在跟踪调研后发现，凡是在青少年时期受过情商培养的孩子，其在学习表现、人际关系及未来的工作成就和婚姻表现方面，都要优于从未受过专门培养的孩子。另有一项针对美国前500强大企业员工所做的调查发现，不论产业类别为何，一个人的IQ与EQ对他在工作上成功的贡献比例为IQ：EQ=1:2，也就是说，对于工作成就而言，EQ的影响是IQ的两倍。而且职位越高，EQ对工作表现的影响就越大。对于行销、客服等工作类别，EQ的影响就更为明显。到底是什么原因让有些孩子的学习成绩那么好呢？张博士指出：成绩=IQ(学习力)+EQ(情商力)心理学者JamesParker针对667名初高中学生做专业情商测试EQ-i,研究情商与学习成绩的关系。结果发现：情商能力与学习成绩呈正相关!所以说，情商对人一生的成功与幸福，都将起到关键作用！同时，它也是可以学习的一种能力！而15岁之前正是情商发展的定型期，亦成为孩子接受情商培养及教育的最佳时期。财商和情商，都影响孩子的一生!不少孩子通过交行《小小金融家》系列活动的学习和体验，不断提升情商力，成为财商达人，以后在成长的路上会更加“完美”。
市场,2016-02/19,“透明3・15”大河报金融消费维权平台成立,□策划大河理财编辑部执行记者席韶阳存款变保险、办房贷遭遇捆绑信用卡、买新车遭遇车险捆绑销售、车险投保容易理赔难……又是一年“3・15”，过去一年的金融消费中，您有哪些不痛快的地方，快快开启吐槽模式吧！在“3・15”消费者权益保护日即将到来之际，大河报“透明3・15”活动继续为您服务，我们将推出金融消费维权平台，开通金融维权热线，面向广大读者朋友征集您对河南金融行业的各类投诉、举报、建议、困惑，大河报将发挥媒体的监督作用，以客观、公正、中立的立场，在金融机构和客户之间建立起沟通的桥梁，消除误解、沟通问题、调解矛盾，维护金融消费者的权益，督促银行业、保险业开展行业自律，为公众提供更好的服务，为行业营造健康的发展环境。如果您在金融消费过程中遇到银行、保险、信托和基金等金融机构或第三方理财公司违规操作误导等问题，可及时与我们联络，大河报将通过调查报道、协调解决或反映到监管部门等方式，维护你的金融消费权益。投诉渠道：1.拨打投诉热线：0371-96211、65795631、657959832.发送电子邮件：dahelic-ai@sina.com3.扫描右方二维码，关注大河理财官方微信“大河金”留言
市场,2016-02/19,猴年理财还需“72变”,□记者席韶阳核心提示|“一年之计在于春”，但猴年开春以来，股市、汇市、期货等投资市场剧烈波动，投资市场的不确定性，让不少拿着厚厚一沓年终奖的朋友也不敢轻易出手了。猴年家庭理财，该怎么定调？如何安排手中的资金，才能更好实现家庭财富的保值增值？对此，记者采访了省会的有关理财师。市场震出新高度新年跌蒙投资者受春节期间海外股市普遍暴跌的影响，本周一，猴年第一个交易日，A股沪深两市也给投资者来了个下马威，几经波折之后，才在本周三收出一根较为像样的中阳线。而与此同时，外汇、期货、有色等大宗商品投资市场，却依旧保持着较为剧烈的震荡。与此同时，市场上降息的预期不绝于耳，开年之后，不少投资者发现，从银行理财产品，到各种互联网平台推出的稳健型理财产品，均纷纷下调预期收益率。高风险的在震荡，低风险的在下滑，这让不少投资者倍感压力。怀揣着春节前拿到的年终奖，如何布局家庭资产，才是实现猴年财富目标的有效途径？家庭理财先定目标再掏荷包“财务计划要跟着市场大势走，不能仅凭个人喜好。”提及猴年理财市场的变化，郑州农业路上一家大型商业银行的理财师小许提醒投资者，在出手投资之前，一定要对自己的家庭资产状况、家庭理财目标有一个清醒的认识和审慎的评估，在此基础上寻找更有效的理财途径。那么，如何确定家庭理财目标？她建议从以下几个方面考虑：首先，确定最近两年内是否有购房、买车、就医等大的家庭开支预期，在此基础上，确定家庭理财的中长期时限，以便选择合适的中长期投资工具和投资途径。其次，客观评估自身的风险承受水平，寻找适合自己的投资市场和理财方式。再次，关注投资市场走势。投资从来不是一蹴而就的事情，它需要你不断积累理财知识、训练自己对市场的敏锐度，只有这样，才能在风险或机遇面前做出更加有利的选择。猴年理财要灵活多元投资分散风险猴年伊始，美联储就宣布将告别零利率时代，未来将采取加息政策。国际市场的不确定性，让投资理财变得更加复杂。而历史数据也显示，没有任何一类资产能够持续在不同的市场周期保持表现出色。过度集中持有某一类资产可能引发亏损，尤其是在该资产类别表现欠佳的情况下。首先，规划出可投资的资金。您需要优先安排3-6个月家庭生活开支作为流动性资产，以满足家庭日常支出及紧急备用金。这笔钱可以投入到活期储蓄、货币型基金、短期可灵活申购赎回的开放式银行理财产品、互联网理财产品等市场。其次，适当补充保障类资产。不妨通过补充商业保险，来降低家庭风险。建议投保的保额以年收入的5-10倍为宜，保费建议为年收入的5%-10%。最后，综合配置资产。您可根据自己的风险偏好进行相应投资。有人觉得资产配置很难，实际上，对于初涉投资领域的新手来说，管理多元化的投资组合并不是非常困难，比如投资多个基金，这样就可以挂钩多个主要股市、债市，实现投资组合多元化。而成熟的家庭，则可在低风险的银行理财产品、国债、债券型基金，以及相对高风险的股市、汇市、期货市场、混合基金市场等投资品类中选择自己熟悉、擅长的品种投资。
市场,2016-02/19,太平洋保险率先推出网络食品安全责任险,日前，太平洋保险旗下的太平洋产险苏州分公司与苏州金麦穗食品有限公司签署苏州市首单网络食品安全责任保险，为“舌尖上的安全”保驾护航。该险种通过保险公司的投保评估，提高了网络食品生产流程的标准化和安全性保障,同时也是对企业和消费者的有效保护。F（记者席韶阳通讯员杜茜西）
热点聚焦,2016-02/19,啥？微信零钱提现要收钱？！,□记者李萍张朝核心提示|一石激起千层浪！不错，2月15日微信支付团队的一则公告，确实震惊整个朋友圈。3月1日起，个人用户的微信零钱提现功能（从零钱到银行卡）开始对超额部分收取手续费，转账恢复免费。根据微信公布的猴年春节期间（除夕到初五）的红包整体数据，微信红包春节总收发次数达321亿次，共有5.16亿人使用微信红包。对于坐拥数亿用户的微信来说，此举未免引来众多质疑、猜测声。[公告]提现收费，系因需向银行支付手续费对于刚过完年，抢了满满红包的市民来说，2月15日微信支付团队的一则公告未免掀起千层浪。公告表示：3月1日起，微信支付对转账功能停止收取手续费。同日起，对个人用户的微信零钱提现功能开始收取手续费。收费方案：按提现金额的0.1%收取手续费，每笔至少收取0.1元。每位用户可获赠1000元免费提现额度。个人用户的微信零钱提现收费并非微信支付追求营收之举，而是用于支付银行收取的手续费。同身份证账号共享1000元免费提现额度。理财通资金赎回到银行卡不受影响，不收取手续费。随后，微信支付团队在微信官方公众号“微信公开课”上发声，解答各方质疑。官方表示基于微信支付的每一笔转账和提现交易，事实上不论金额大小，银行都要向微信支付收取交易手续费。此次调整是为进一步优化服务资源配置，更专注地服务好小额高频的社交转账，以及更广泛线上线下消费。本次向用户收取的提现费率为0.1%，而微信需要支付给银行的手续费是平均高于0.1%。微信支付团队正在积极与银行方面密切沟通，争取早日实现转账、提现交易完全免费。并表示，除了提现，微信支付无论在线上还是线下的使用场景已经非常丰富，还友情链接了“了解微信零钱的10000种用法”一文，文章最后讲到用储蓄卡购买旗下理财通产品，提现免费。[争议]多数人对此不服，部分微商将受影响喜欢玩微信的市民都知道，微信用户提现交易主要是将微信钱包里的零钱提现到银行卡，而“零钱”来源主要是抢红包和微信转账。对于微信的此举，多数市民给予质疑，也有人给出理解的态度。“零钱本身就是我的钱，提现为什么还要收取手续费？”不少微信用户说，他们已习惯微信支付、转账，再提现，每个月微信零钱的累计金额肯定超1000元，这样一来就“白白”损失一些钱。也有部分微信用户表示理解，因现跨行取钱也需给手续费，而从互联网公司到银行，也有一定类似。看似很少的费用，是否会对大家造成不小的影响呢？有业内人士说，对于一般抢红包或小额转账提现的人来说，影响并不大，毕竟超过该额度才可收取0.1%的费用。然而，其对于一些小微商来说，确实会造成一定的影响。郑州的王女士一直在微信圈从事化妆品生意，她给记者算了笔账。平时将货卖给客户后，客户将钱直接转她微信中，每当微信零钱累积到两三千元便会提现，每月平均收入能达2万多元。而以后，她将为此多付出几十元的手续费，看似不算高，但意味着自己的成本增加了。而对此，微信方面表示，正规的微商都有公司账户，收的钱都是直接进入绑定的银行卡里，不存在提现这个过程，就不会受到影响。但对那些没有注册成为正规微商，没有公司账户，只是在朋友圈里兼职小规模卖点东西的人，今后提现可能会有点小小的费用。[质疑]微信此举，是否醉翁之意不在酒？微信此举，是不是拿银行做挡箭牌，醉翁之意不在酒呢？对此质疑，不少财经、互联网行业专家给予分析。中央财经大学教授郭田勇认为，微信支付对提现功能收取手续费，其目的可能是希望资金沉淀在微信体系内，进行内部循环。尤其是今年春节期间，不少人抢红包，微信平台沉淀资金比较多。在监管趋严的背景下，微信支付此举是想通过提现收费先行做好资金沉淀的准备。易观智库金融行业中心研究总监马韬表示，之前微信支付转账收费，原因之一是为了其自身支付生态的健康度考虑，很多商户为节省手续费，进行结算时，通过转账来完成，这次提现收费可能一方面也是为了构建支付生态的健康度，对以上的现象进行约束。还有专家认为，此举还意在推广微信线上支付。对于第三方支付平台来讲，不太鼓励用户通过平台来转账，他们更愿意用户将平台当做支付工具，而非转账、提现的工具，之所以收取费用，也是为了慢慢杜绝用户转账、提现的使用习惯。就是说微信提现收取手续费的真实目的是想借机构建微信支付生态圈。另外，微信一直鼓励用户把零钱包的资金转入“理财通”，变成“零钱理财”。[欣慰]支付宝、百度钱包暂不跟进在回答外界对微信提现收费最关心的9个问题时，微信支付团队称“隔壁的第三方支付平台实际上也需要为用户使用银行接口向银行缴手续费，其早在2013年12月通过电脑转账就进入了收费时代。”对于微信对提现项目开始收费一事，其他第三方支付平台并未跟进。支付宝官方表示：“十一年来，用户通过支付宝提现，不管是pc端还是手机上，均为免费。支付宝内发生的每一笔转账和提现交易，银行都会向支付宝收取交易手续费，这部分费用由支付宝承担，用户无需支付额外费用。”另外，百度钱包到目前为止不只是免各种手续费，而且还有返现政策。百度钱包的相关负责人也表示，目前百度钱包的提现和转账没有收费的打算。加之自2015年以来，多家商业银行宣布将正式进入“网上转账全免费”时代：所有个人客户通过网上个人银行、手机银行APP办理境内任何转账业务（包括异地和跨行），均享受零费率。而第三方支付们把人圈起来之后，却逐渐将免费的项目变为收费，虽然钱不多，不免让人心里不舒服。[对策]面对收费“新政”，网友纷纷出招应对超出1000元的免费限额，提现就要收手续费，那么，想免去这部分费用，只有一个办法，就是不提现。业内人士表示，AA收款、微信红包、线上和线下消费、用零钱投资理财通，这些都是不收费的。也就是说，以后你用微信里的零钱购买电影票、聚餐买单、打车，或者在理财通里买入一款理财产品，均不用支付手续费，就是多使用零钱支付及转账功能。不想被收费很简单，还有网友直接给出几个方案。3月1日之前将零钱全部提现，此后慎重玩红包；尽情享用微信红包、微信转账功能，然后多多使用微信支付方式；先用零钱买理财通，赚点钱就提现到银行卡，就等于免手续费；微信零钱支持信用卡还款，且免手续费，把钱多转个弯而已。
通信家电,2016-02/19,提现收钱，微信算你狠！,微信：下月起，零钱提现开始收手续费。网友：啥？！你在开玩笑吗？！微信：按0.1%收，每笔至少收0.1元，每人赠1000元免费提现额度。网友：Oh！No！！！！（各显神通，“曲线救国”）收钱真的没那么容易！详见B02版
市场,2016-02/19,泰康人寿联手胡润2月25日在郑举办医养论坛,由胡润百富与泰康人寿联合举办的“中国高品质医养论坛暨中国高净值人群医养白皮书发布会”（郑州站）将于2月25日来到河南郑州，为中原百姓详细解读我国高净值人群养老和医疗需求。届时，泰康人寿董事长陈东升将携手胡润，共同发布白皮书内容，这也是中国首份针对高净值人群养老和医疗需求的专业报告。F(记者席韶阳通讯员王若谷）
足球,2016-02/19,焦作体育大拜年“根本停不下来”,□记者王玮皓本报讯百乡千村农民篮球赛、老年门球夺杯赛、DJ酷走、抖空竹、柔力球……2016年春节期间，焦作市体育局组织开展体育大拜年系列全民健身活动，让热爱运动的人们“根本停不下来”。2月17日开始，被誉为焦作市农村“NBA”的农民篮球赛――焦作市百乡千村农民篮球赛总决赛，已分别在焦作市山阳区和沁阳市两个赛区分别举行。由此拉开了全市迎新春体育大拜年全民健身活动的序幕，吸引了众多农民朋友参赛。同日上午，为期5天的焦作市迎春足球比赛在太极体育中心足球场开赛。该赛事从1994年起每年都会举办，也是焦作市一项传统的精品赛事。昨日上午，焦作市老年门球夺杯赛和DJ酷走、抖空竹、柔力球展示活动在市太行路全民健身中心门球健身苑拉开序幕。同时，河南省迎新春气排球联谊赛也在市体育中心开战，来自全省15个代表队250名运动员将参加为期3天的比赛。未来几日，河南省第十二届迎新春中原武术大舞台武术展示交流活动、广场舞展示交流活动、市首届青少年羽毛球比赛还将分别上演。在此期间，焦作市各县区、社区都将举办文体展演、各种球类运动、农民运动会等丰富多彩的群众体育健身活动，预计春节期间全市参与健身的群众达30万人次。
