要闻,2016-02/19,正大国际广场元宵喜乐会即将暖心开启,□记者曹智强一曲笙歌春如海，千门灯火夜似昼。正大国际广场元宵喜乐会即将暖心开启，“元宵节，月亮圆，黏黏元宵黏又甜，观花灯，踩高跷，大街小巷真热闹……”来正大一起做元宵、猜灯谜、抢红包吧，过一个最正宗的元宵节！带着美好的祈愿，为新一年的工作、学习博个好彩头！（G）活动时间：2016年2月20日-21日上午10:00-11:00、下午3:00-5:00
综合,2016-02/19,居然之家五大活动闪耀元宵佳节,□记者杜一格浓情元宵，居然之家“元宵五天乐”团购活动即将幸福来临。昨天，居然之家郑州店宣布，2月20日-22日、27日-28日，将推出“元宵五天乐”五大主题活动，为市民打造家居盛宴。直降惠――满1000元最高直降300元。活动期间，顾客在居然之家购买指定品牌产品（参与品牌详见各品牌店公示），满1000元最高直降300元，满2000元最高直降600元，以此类推。折扣惠――过节不议价，再享9.5折。活动期间，在最低成交价基础之上，顾客在商场购物交全款均可在最低成交价基础上再享9.5折（不与欧美惠同时参加）。欧美惠――欧美限时狂欢日。活动期间，每天下午限时四小时，购买四楼欧美家具的顾客在成交价基础上每满10000元直减500元（不与折扣惠同时参加）。娱乐惠――元宵佳节乐享高尔夫。活动期间，进店顾客均可参与迷你高尔夫游戏，每位顾客每单限参与一轮。连环惠――抽奖活动提前享。活动期间，交款满2000元，可领取抽奖券一张，满4000元可领取抽奖券2张，以此类推，单张合同最多领取3张抽奖券。凭抽奖券可参与商场3・15活动抽奖。
综合,2016-02/19,赛博“TourTalk译游”让日本商家懂中文,□记者杜一格中国游客自由行赴日，“语言不通”成为日本商家的压力。对此，赛博集团研发全球首套多国语言真人视讯实时在线翻译系统“TourTalk译游”，商家只需使用电脑或手机终端，就可以提供商家语言翻译服务。随着2016年东京缤纷购物节开始，赛博集团以涩谷地区为首个发展商圈，从今年元旦开始推广，目前已有百余商家装设“TourTalk译游”系统，使这里成为游客心中语言最友善店家。
综合,2016-02/19,珠灯璧月年时节元宵扮家小妙招,□记者杜一格核心提示|才赏除夕万家灯火,又见十五华霓幻海。元宵节即将到来，在亲人们合家团聚的时候，不仅要吃汤圆、赏花灯，更要扮靓爱家。在这喜气洋洋的日子里，只要对家中装饰稍作改善，就能让应景花灯、温暖情调、跳动颜色和明快的搭配营造出一片浪漫温馨，让全家在猴年“大圣开年，开年大胜”！◇用粉色渲染节日味儿喜庆节日，营造氛围尤为重要，而颜色又是最好的武器。可考虑粉红、粉紫等粉色系装扮节日，这些带有透明感觉和女性感觉的色彩不仅在服装当中盛行，在家居饰品中近年也流行开来。选择温和的粉色系，能够通过同色系的微妙变换取得丰富的家居效果。比如，窗帘、床罩不妨在节日里更换为粉色调的。◇灯笼必不可少元宵节里灯笼肯定是当仁不让的主角，有设计师建议，元宵节家居布置一定要有灯笼元素。眼下，花灯的造型精美多样，动漫形象、水果等造型的花灯一定会让您爱不释手。市面上更有为孩子准备的动漫形象系列手持花灯。如果您是一个动手能力强的人，不妨准备些秸秆、铁丝、纸、糨糊，自己做一个灯笼，还可以贴上自己喜欢的图案。如果家里没有地方摆这些花灯，也可以购买一些彩色串灯，挂在窗户上，同样能增加节日气氛。◇花香飘满屋，用鲜花装扮居室花与灯是对孪生姊妹，流光溢彩的节日里怎能没有鲜花做伴，元宵节期间开花的花卉品种非常丰富，凤梨、蝴蝶兰、仙客来、海棠等都是不错的选择，它们有的是以鲜艳花朵吸引眼球，有的是以硕美枝叶争宠，其中不乏寓意吉祥的花卉，比如“一帆风顺”、“鸿运当头”等。◇精巧餐具食色生香节日当天，全家人围坐在一起吃元宵、看电视，温馨又热闹。不少家居设计师则建议，如果能在餐具上花点心思就更加美妙了。近年来餐具逐渐从单一化向组合化、成套化过渡，汤勺、碗、碟无论从图案还是造型上都有了很大的改变、骨瓷的、烫金边的、雕花的……全家围坐，觥筹交错，精美器皿配上节日美食可谓风情万种。
要闻,2016-02/19,永久居留外国人将享公民同等待遇,要闻,2016-02/19,标题新闻,2020年公共机构广泛应用新能源汽车包括国家机关、学校、医院、文化、科技、体育场馆环境保护部部长陈吉宁：200家环评机构今年脱钩据新华社电
综合,2016-02/19,聊聊咱的消费新常态,□记者王永安核心提示|如今，新常态已不算什么新词，但人们对一些领域正在形成的新常态，还很模糊。比如，商业模式变革的影响，在消费领域引发连锁反应，消费新常态是什么？近日，大河报记者对此进行了社会调查。网购、体验、互动，催生消费新常态采访中发现，消费新常态分为多个层面。一方面，线上商城的异军突起，催生网购族。线上消费最开始对人们产生的最大吸引力莫过于两个字：便宜。但后来人们很快发现，网上销售的商品良莠不齐，有相当一部分出现假冒伪劣的状况。但这并没有阻挡线上商城的发展步伐，究其原因：一是人们在教训中不断成长，对假冒伪劣有了一定的免疫力；二是线上消费可以随时随地发生，在当下具有不可替代的便利性，而且有这种便利消费需求的人群越来越壮大。另一方面，实体商业也在发生着巨大的变化，对人们的消费行为产生着很大的影响。就在2013年以前，家电卖场、超市都进行着野蛮生长。价格杀手、价格屠夫，这些最能撩拨人们心弦的词汇先后成了一些商业连锁的标签、冲锋号。跑马圈地之时，“马”尚未至却已是人心所向，那时新店开业之际，人山人海，阻断交通，挤破门窗的情形，时有发生。近几年来，随着线上商城的崛起，对实体连锁产生冲击，有的黯然关店、退场，一些连锁企业借机调整发展策略，把开新店重点放到商圈之外、离老百姓最近的街区，开展全网比价、延时营业，此外，最能撼动消费者的莫过于体验式消费……最令消费者纠结并重新审视自己消费行为的，莫过于一些强势商业连锁“一体两翼”的发展模式了――O2O商业模式。长期以来，线上、线下竞争的就是谁更便宜、谁更便利、谁更贴心。现在，一家兼有两种模式，这不是左手搏右手吗？商家线下、线上的竞争，最终让消费者看了热闹，还是得了便宜？“我的消费新常态”栏目，邀您献计献策在3・15即将来临之际，针对当下的商业战局，为给人们的消费行为、商业的调整发展提供一个良好的参考，《大河报大河卖场》推出“我的消费新常态”互动栏目，请大家结合自己的实际经历，围绕以下几个方面献计献策。1.您处于哪个年龄段？习惯于线上消费，还是实体店消费？为什么？2.您在什么情况下会选择线上消费？线上哪些优势让您作出这一选择？线上存在哪些问题，需要人们在消费时关注警惕？线上商业急需解决和阻碍发展的问题有哪些？3.您在什么情况下会选择前往实体店消费？实体店哪些优势让您作出这一选择？实体店存在哪些问题需要人们在消费时更加关注和警惕？实体商业急需解决和阻碍发展的问题有哪些？您可以把互动内容发送到电子信箱dhbwya@qq.com；也可微信搜索“dhblegou”，关注大河报大河卖场微信订阅号，把互动内容发送给该订阅号；或微信添加好友"DH-BWYA"，把内容直接发送给记者。参与此次互动就有机会获得，尊贵的礼品――大河报年卡可以免费，看报一年噢！
要闻,2016-02/19,去年抓106.2万人次“瘾君子”“初犯”刚好占一半,民生,2016-02/19,采纳本报建议陇海高架错峰施工,□记者张瞧本报讯2月17日本报C02版以《陇海快速路被施工拖累成“慢性子”》为题，报道了因快速路加装隔音墙，且施工放在车流量大的白天，因施工和物料占道，引发快速路大规模拥堵。昨日，大河报记者从陇海快速路加装隔音墙总承包部的相关负责人处获悉，为方便市民出行，加装隔音墙工作已改为错峰施工，夜间施工时段为晚8点半至次日凌晨6点。昨日下午，总承包部的相关负责人告诉记者：“两天前市里要求我们将装隔音墙的工作安排在车流量小的时段，尽力保障市民出行的道路通畅。另外，我们通过大河报的报道获悉，市民们也迫切希望我们错峰施工。”该负责人表示，陇海快速路于1月底开始加装隔音墙，原计划陇海快速路中州大道至西三环段音障设施将于3月底全部完工。“如今部分工作人员分流到夜间施工，作业时间是晚8点半到次日凌晨6点。更改作业时间后，加装工程何时能完工还不好说。”该负责人告诉记者，因工程工期紧，夜间施工已不可避免。当记者提到之前施工为何不在夜间进行时，该负责人表示，在白天施工是为了保障施工人员的人身安全，虽然夜间施工期间有足够的照明设施，但其光亮度并不能和白天相比。“再加上一些司机车速过快，等看到施工标志或施工灯光时再刹车避让，恐怕来不及。若是碰上酒驾的，那后果不堪设想。”此负责人表示，为保证夜间正常施工，工程部会采取一系列安全保障措施，如作业车辆上设置明显的作业标志、启用夜间施工移动照明车、施工路段两端设置明显的施工标志、安全标志等。“虽然陇海快速路限速80公里/时，为保证市民和车辆、施工机械和施工人员的安全，希望夜间驾车走快速路的司机朋友要减速慢行，以便能及时避让开施工路段。”
民生,2016-02/19,北区城中村要拆了“郑漂”搬到哪儿公交“追”到哪儿,□记者田园通讯员崔晨本报讯春节后，怀揣梦想的郑漂族再次回到郑州，可刚过来就得知，刘庄、高皇寨、庙李等三大城中村要拆了。昨日，郑州公交二公司发布消息称，针对客流变化，即日起，向郑州市民尤其是郑漂一族公开征集郑州北区公交线网的设计、优化方案。记者了解到，庙李、刘庄和高皇寨等三个城中村的拆迁改造已启动。3月底前，上述三个城中村内住户将全部搬迁。“搬迁出去的人员住到哪儿，公交布线就跟到哪儿。”对此，郑州公交二公司主管运营的副经理薛来告诉记者，公交公司将积极应对客流变化，向郑州市民尤其是郑漂一族公开征集郑州北区公交线网的设计、优化方案。“如果市民对北区城中村拆迁后的北区公交线路有任何意见，或是有市民搬迁到新的城中村，但那里公交车少甚至没有通公交车，都可以说说。”薛来表示，将根据征集来的意见，最终共同敲定公交线路，以方便市民出行。如果您想对北区公交线路设计发表意见，可@公交二公司官方微博，或将您的设计方案发送至邮箱854828474@qq.com。
全媒体生活服务平台,2016-02/19,工人路 300米路段成了“石子路”,综合,2016-02/19,管没管好炮，看看天就知道,□记者王磊文白周峰摄影本报讯春节期间，信阳、周口等地未出“禁炮令”或“限炮令”，空气质量明显恶化。昨天记者获悉，河南省大气污染防治联席办公室通报：全省春节期间空气质量有所改善，但信阳、周口等部分地区的烟花爆竹禁限放工作开展不力，空气质量出现急剧恶化。“郑州、平顶山、焦作、三门峡等市对春节期间烟花爆竹禁限放工作高度重视，出台了烟花爆竹禁限放相关办法，有效遏制了烟花爆竹燃放对空气质量的不良影响，空气质量改善明显。”河南省大气污染防治联席办公室有关负责人介绍，2月7日至13日，与2015年春节期间相比，郑州、洛阳、平顶山、安阳、焦作、三门峡、济源等市的可吸入颗粒物（PM10）浓度均不同程度下降，其中，焦作（降低45微克/立方米，下降24.6%）、三门峡（降低41微克/立方米，下降19.2%）、安阳（降低34微克/立方米，下降16.3%）、郑州（降低27微克/立方米，下降14.4%）4市下降比例较高。据介绍，濮阳、漯河、商丘、周口、驻马店、信阳等市对烟花爆竹禁限放工作重视不够，未制定有效的烟花爆竹禁限放工作方案，政府监管缺位，致使春节期间环境空气质量明显恶化。他说，开封、鹤壁、新乡、许昌、南阳等市虽然对烟花爆竹禁限放工作进行了安排部署，但是督查监管不够到位，禁限放措施落实不够有力，春节期间空气质量也出现了不同程度恶化。数据显示，2月7日至13日，与2015年春节期间相比，开封、鹤壁、新乡、许昌、漯河、濮阳、南阳、商丘、周口、驻马店等10个省辖市PM10浓度均不同程度上升，其中，商丘（升高112微克/立方米，上升107.7%）、周口（升高63微克/立方米，上升45%）、驻马店（升高48微克/立方米，上升38.4%）、许昌（升高52微克/立方米，上升37.7%）、漯河（升高53微克/立方米，上升37.6%）5市上升比例较高；商丘（216微克/立方米）、周口（203微克/立方米）两市平均浓度最高；信阳2月7日至8日大气污染非常严重，PM10最高浓度达558微克/立方米。“春节期间各地的空气质量状况再一次证明，做好烟花爆竹禁限放工作是应对节日期间重污染天气的最有效手段。”上述负责人说，还没有出台烟花爆竹禁限放规定的地方，要抓紧出台方案，强化监管措施，明确部门责任，加强烟花爆竹禁限放管理工作。据了解，在发出通报的同时，省大气污染防治联席办公室特别向信阳、周口两市主要领导致信，指出两市在春节期间对烟花爆竹禁限放工作重视不够、准备不足、应对不力，未制定有效的烟花爆竹禁限放工作方案，致使春节期间环境空气质量明显恶化。省大气污染防治联席办公室要求信阳、周口两市主要领导要高度重视烟花爆竹禁限放和安全监管工作，把元宵节期间烟花爆竹的禁限放工作列入政府近期重点工作，尽快出台烟花爆竹禁限放规定。
民生,2016-02/19,世纪联华搬走了公交场站将拆除52路咋走您说说看,□记者田园通讯员罗伟华本报讯最近，郑州世纪联华汝河店搬迁。受此影响，在此停靠的52路、58路和900路的公交场站将拆除，这个路段的公交车辆的停车、调度成了难题。即日起，郑州公交总公司将广泛征求市民意见，并根据市民意见对52路和103路进行优化调整。据郑州公交总公司负责人介绍，今年1月初，郑州市公交总公司接到世纪联华汝河店拆迁通知，同时在此停靠的52路、58路和900路的公交场站将拆除。“旧址被拆除，80台公交车一下子没了家。”这名负责人说，受影响最大的是52路，而58路和900路进行局部调整即可。对此，公交部门拟优化52路，将52路在大石桥或医学院附近调头返回，主要承担东半部分市民出行任务。拟将103路调整为52路西线，以满足西区市民出行需求。调整后，52路和103路在大石桥及铭功路可以进行无缝换乘。那么，之前的世纪联华到七里河的两端客流怎么办？公交部门表示，两端的直达客流可乘坐新开通的B5。随着B5的东延，从西到东乘坐公交将更加方便。市民可以就52路及103路的线路优化、站位设置、发车间隔和运营时间等方面提出合理的意见和建议，拨打郑州公交客服热线63881333或拨打电话68089559（工作时间），发送邮件至374641973@qq.com，受理时间为2016年2月19日至2月25日。
民生,2016-02/19,流脑疫苗断货3个月妈妈们着急了,□记者李晓敏本报讯“3岁女儿该打流脑疫苗了，但从1月份到现在，一直没有疫苗，怎么回事啊？”“我家孩子10个月，该打流脑疫苗了，但社区一直说没货……”昨天，记者接连接到一些家长咨询，问题的核心均是：流脑疫苗缺货。昨天上午，记者专门赶到郑东新区永平路和东周路交叉口的郑州市第一人民医院郑东医院，该院四楼是一个专门的儿童疫苗接种点。“请问咱们这儿有流脑疫苗吗？”记者问。“免费的没有货，有可替代品，是自费的，而且比免费的还要好。”一名护士回答说。“那免费的疫苗何时能供货？”“不知道，断货3个月了。”护士说。随后，记者走访金水区、二七区几家社区卫生服务中心，结局一样。当记者将这个问题反映给省疾控中心时，该中心免疫规划所副所长张延炀说，出现这种情况是因为去年年底，有资质的疫苗供应厂家到期，而新的供应厂家需要通过招标等形式进行，而这需要一定的时间，因此耽误了流脑疫苗的及时供应。不过，他介绍，前一段时间，省疾控中心已经采购了一批流脑疫苗，目前已经分发到各个地市的卫生部门，近期，这些疫苗将会逐步运送到社区接种点，届时，孩子们就可以接种了。对于疫苗接种问题，张延炀建议家长，要及时地按照免疫程序进行接种，不过，疫苗接种的时间遵循的一个原则是，可推迟但不可提前。因此，如果孩子该接种疫苗时身体出现不适，要等一切康复后再进行，而这不会影响疫苗的接种效果。
民生,2016-02/19,供血紧张原定春节前做的手术现在还没着落,□记者李晓敏本报讯因为没有血液保证，原本准备春节前进行肾移植手术的吴先生，一直等到昨天也没能进入手术室。昨天，记者多方了解后得知，在郑州多家医院内，像吴先生这样择期手术等待的病人并不在少数。“因为供血紧张，只能保证应急用血，择期手术的病人只能往后推迟了。”昨天，省血液中心招募办主任郭俊勇说，该中心从今年1月份前后，供血就进入紧张时段，而这种紧张局面到目前也没缓解，预计还会持续半个月左右时间。据他介绍，正常的库存量应该在1万到1.5万个单位（200毫升为一个单位），满足7到10天使用量，但一个多月前，中心血液库存量每天都徘徊在2000个单位，目前，虽然情况稍微有一点点好转，但也只能保证在3000个单位左右，郑州多家医院临床用血受到影响。谈及原因，他认为这一方面有季节的原因，比如春节放假，天气寒冷、交通拥堵等，都会影响采血量；另外，流动采血车不能顺利停靠在郑州繁华地段，也是一个因素。对于这一点，省血液中心采血一科科长刘国英深有体会。她说，街头献血，随意性比较大，因此，如果采血车能够停靠在人群比较聚集的地方，比如万达、百货楼、二七塔、王府井、曼哈顿等附近，那采血量会明显上升。但是遗憾的是，这些繁华地段很多地方设的有隔离墩、栏杆等，献血车无法停靠。据了解，目前市民献血可以去省血液中心或者大学路献血屋、新密献血屋、巩义献血屋，同时也可去单位或家附近的流动献血车上。
